{
  "$schema": "https://json-schema.org/draft/2020-12/schema",
  "$id": "https://latticeandcompany.github.io/lattice/schema.json",
  "title": "Lattice Configuration",
  "description": "Schema for lattice.json, the root configuration file of a Lattice monorepo. Workspaces are declared as objects with literal paths; globs are not accepted.",
  "type": "object",
  "additionalProperties": false,
  "properties": {
    "$schema": {
      "type": "string",
      "description": "Optional reference to this JSON Schema (e.g. \".lattice/schema.json\")."
    },
    "latticeVersion": {
      "type": "string",
      "description": "The version of Lattice this repo runs. An installed binary that is not this version installs it and hands over, so everyone gets the same build."
    },
    "workspaces": {
      "type": "array",
      "description": "Explicitly declared workspaces. Each entry is a single project directory (no globs).",
      "items": {
        "$ref": "#/$defs/workspace"
      }
    },
    "engines": {
      "$ref": "#/$defs/engines",
      "description": "Root-level toolchain defaults for all workspaces."
    },
    "globalDependencies": {
      "type": "array",
      "description": "Repo-root-relative globs hashed into every task's cache key. Use for files shared across workspaces, such as a base tsconfig, a schema directory, or a root .env.",
      "items": {
        "type": "string"
      }
    },
    "globalEnv": {
      "type": "array",
      "description": "Environment variable names whose values are hashed into every task's cache key.",
      "items": {
        "type": "string"
      }
    },
    "tasks": {
      "type": "object",
      "description": "Named tasks and how they relate across the workspace graph.",
      "additionalProperties": {
        "$ref": "#/$defs/pipelineTask"
      }
    },
    "settings": {
      "$ref": "#/$defs/settings",
      "description": "Repo-wide knobs."
    }
  },
  "$defs": {
    "workspace": {
      "type": "object",
      "additionalProperties": false,
      "required": ["name", "path"],
      "properties": {
        "name": {
          "type": "string",
          "description": "Workspace name (required)."
        },
        "path": {
          "type": "string",
          "description": "Literal directory path (relative to repo root) to the workspace. Never a glob."
        },
        "auto": {
          "type": "boolean",
          "description": "When true (default), infer engine and task commands from the native manifest."
        },
        "engines": {
          "$ref": "#/$defs/engines",
          "description": "Per-workspace toolchain constraints; overrides/pins the inferred engine."
        },
        "dependsOn": {
          "type": "array",
          "description": "Other workspaces (by name) this one depends on.",
          "items": {
            "type": "string"
          }
        },
        "scripts": {
          "type": "object",
          "description": "Explicit script-name -> command overrides.",
          "additionalProperties": {
            "type": "string"
          }
        }
      }
    },
    "engines": {
      "type": "object",
      "description": "Name-keyed map of engine constraints. Each value is either a version constraint string or a detailed engine spec object.",
      "additionalProperties": {
        "oneOf": [
          { "type": "string" },
          { "$ref": "#/$defs/engineSpec" }
        ]
      }
    },
    "engineSpec": {
      "type": "object",
      "additionalProperties": false,
      "properties": {
        "version": {
          "type": "string",
          "description": "Version constraint (e.g. \">=13.0.0\")."
        },
        "versionCmd": {
          "type": "string",
          "description": "Command that prints the tool's version (e.g. \"g++ --version\")."
        },
        "installCmd": {
          "type": "string",
          "description": "Command used to install the toolchain."
        },
        "bin": {
          "type": "string",
          "description": "Bin directory relative to the toolchain install (defaults to \"bin\"). It must be relative and stay inside the install: this directory is prepended to every task's PATH."
        }
      }
    },
    "pipelineTask": {
      "type": "object",
      "additionalProperties": false,
      "properties": {
        "dependsOn": {
          "type": "array",
          "description": "Task dependencies. `^task` means the same task in dependency workspaces.",
          "items": {
            "type": "string"
          }
        },
        "inputs": {
          "type": "array",
          "description": "File globs hashed to determine cache keys.",
          "items": {
            "type": "string"
          }
        },
        "outputs": {
          "type": "array",
          "description": "File globs captured as cached artifacts.",
          "items": {
            "type": "string"
          }
        },
        "ignore": {
          "type": "array",
          "description": "File globs excluded from input hashing.",
          "items": {
            "type": "string"
          }
        },
        "env": {
          "type": "array",
          "description": "Environment variable names that affect the task's cache key.",
          "items": {
            "type": "string"
          }
        },
        "persistent": {
          "type": "boolean",
          "description": "When true, the task is long-running (e.g. a dev server) and never cached."
        },
        "cache": {
          "type": "boolean",
          "description": "Whether outputs of this task are cached."
        },
        "timeout": {
          "oneOf": [
            { "type": "string" },
            { "type": "integer", "minimum": 1, "maximum": 31536000 }
          ],
          "description": "How long the task may run before it is killed, e.g. \"90s\", \"10m\", \"1h\", or a whole number of seconds. The maximum is 31536000 (365 days). Ignored for persistent tasks."
        }
      }
    },
    "settings": {
      "type": "object",
      "additionalProperties": false,
      "properties": {
        "maxCacheSize": {
          "type": "string",
          "description": "Upper bound on the local cache size (e.g. \"10GB\")."
        },
        "cacheDir": {
          "type": "string",
          "description": "Directory for the local cache, relative to the repo root (defaults to \".lattice/cache\"). It must stay inside the repo and cannot be the repo root itself: `lattice prune` deletes cache archives and partial writes in whatever directory it names."
        },
        "loquacious": {
          "type": "boolean",
          "description": "When true, emit extra-verbose output."
        },
        "versionCheck": {
          "type": "boolean",
          "description": "When true (default), compare the running binary against latticeVersion. Set false to run whatever binary is invoked."
        }
      }
    }
  }
}
